{
  "schemaVersion": "1.0",
  "providerId": "gowm.world-evidence",
  "operationId": "world.get-state-history",
  "operationVersion": "1.0",
  "semanticProfileHash": "sha256:3d3fbb3eb1ca844aefcdcead857cb82216cf543b85bcadf078fe2a28d41b1172",
  "rulesApplied": [
    "S001",
    "S002",
    "S003",
    "S004",
    "S005",
    "S006",
    "S007",
    "S008",
    "S009",
    "S010",
    "S011",
    "S012",
    "S013",
    "S014"
  ],
  "evidence": [
    {
      "kind": "DESCRIPTOR",
      "path": "contracts/manifests/providers/world-evidence-provider.json",
      "sha256": "11722e25afbff2899bec94dc8ddac6bff4a4f5dc4d0d6937e13110f3cfd0835b"
    },
    {
      "kind": "PORTS",
      "path": "contracts/manifests/providers/world-evidence-provider.json",
      "sha256": "11722e25afbff2899bec94dc8ddac6bff4a4f5dc4d0d6937e13110f3cfd0835b"
    },
    {
      "kind": "INPUT_SCHEMA",
      "path": "contracts/gowm-v0.4/catalog-query-request.schema.json",
      "sha256": "6ad1a9f486f517cffc8d49dd588b5e48a2bfe2eac20c872a90f9acb9ea5981e8"
    },
    {
      "kind": "OUTPUT_SCHEMA",
      "path": "contracts/gowm-v0.4/catalog-result.schema.json",
      "sha256": "e1efea73a0a57cd71ba303c36e165df05e936ad5b0cb8747390cf305e2f3f609"
    },
    {
      "kind": "TYPESCRIPT_IMPLEMENTATION",
      "path": "services/providers/grounding-catalog-provider/src/provider.ts",
      "sha256": "cdd12e87c8210dc521364788d0e2f3bc37f85d2273536f6901415aa941ca6b8e",
      "symbol": "createGroundingCatalogProvider"
    },
    {
      "kind": "TYPESCRIPT_IMPLEMENTATION",
      "path": "services/providers/grounding-catalog-provider/src/repository.ts",
      "sha256": "ed1ab8ef0e44941a051ee01db7973adbdf538b37d4bb31e8191983d005f7913b"
    },
    {
      "kind": "UNIT_TEST",
      "path": "tests/platform/grounding-catalog-provider.test.ts",
      "sha256": "20a96fcf92abcf5a8be85a07f213572c7998c6f51d9d4b4ce344c617858626b4"
    }
  ],
  "status": "PROVEN",
  "notes": [
    "Provider-owned declaration reconciled against the descriptor, input/output schema, adapter handler and tests. Reference kinds describe accepted/produced contract syntax, not guaranteed matches; empty results do not prove absence."
  ]
}
