{
  "schemaVersion": "1.0",
  "providerId": "gowm.crs-normalization.bridge",
  "operationId": "crs.check-source",
  "operationVersion": "1.0",
  "semanticProfileHash": "sha256:0d8cf3ce49f44c07a948401f873409525974eb296f8c954fdedd69074adff4bf",
  "rulesApplied": [
    "S001",
    "S002",
    "S003",
    "S004",
    "S005",
    "S006",
    "S007",
    "S008",
    "S009",
    "S010",
    "S011",
    "S012",
    "S013",
    "S014"
  ],
  "evidence": [
    {
      "kind": "DESCRIPTOR",
      "path": "contracts/manifests/providers/crs-provider.json",
      "sha256": "39a0da18d9559f0f0b076e83e72ad74a521a2ea4bd7fa6c73e8d1cb436c7c223"
    },
    {
      "kind": "PORTS",
      "path": "contracts/manifests/providers/crs-provider.json",
      "sha256": "39a0da18d9559f0f0b076e83e72ad74a521a2ea4bd7fa6c73e8d1cb436c7c223"
    },
    {
      "kind": "INPUT_SCHEMA",
      "path": "contracts/capabilities/crs.check-source/input-1.0.schema.json",
      "sha256": "29ae59b90a8725af03a653ad6e1bf5fc3a99758d8ebee225f6716722c2753c21"
    },
    {
      "kind": "OUTPUT_SCHEMA",
      "path": "contracts/capabilities/crs.check-source/output-1.0.schema.json",
      "sha256": "deb3812552ec3077e0f7ade395d3feb6638f715981c43ad71f78c0d5ee702162"
    },
    {
      "kind": "TYPESCRIPT_IMPLEMENTATION",
      "path": "services/providers/crs-provider-bridge/src/provider.ts",
      "sha256": "6ace70c6a9f904709d3c3aaa54d4a2a52330f6439d57418b70b0a9ec795a558a",
      "symbol": "createCrsProviderBridge"
    },
    {
      "kind": "UNIT_TEST",
      "path": "tests/platform/provider-gateway.test.ts",
      "sha256": "c79f9e5291d0d9ebbb97b9bf530b482c8f9766736a3fb3dc9bfc0bf81392d62f"
    },
    {
      "kind": "SOURCE_LOCK",
      "path": "contracts/manifests/providers/crs-provider-source-lock.json",
      "sha256": "c1f0bf6895ac1f9fca2ac8c3e1ccb29b6b6a2967acddc705944bd428e3a26b53"
    }
  ],
  "status": "PROVEN",
  "notes": [
    "Provider-owned declaration reconciled against the descriptor, input/output schema, adapter handler and tests. Reference kinds describe accepted/produced contract syntax, not guaranteed matches; empty results do not prove absence."
  ]
}
