{
  "schemaVersion": "1.0",
  "providerId": "gowm.network",
  "operationId": "network.connectivity.inspect",
  "operationVersion": "1.0",
  "semanticProfileHash": "sha256:309a62a867da227b7881f22d35253c97bee3a202c332f7949e4b27f908d50637",
  "rulesApplied": [
    "S001",
    "S002",
    "S003",
    "S004",
    "S005",
    "S006",
    "S007",
    "S008",
    "S009",
    "S010",
    "S011",
    "S012",
    "S013",
    "S014"
  ],
  "evidence": [
    {
      "kind": "DESCRIPTOR",
      "path": "contracts/manifests/providers/network-provider.json",
      "sha256": "64970ecfb360b9add757ccca1c9adf8b6f6964b6a0e793285f3b1f29efbea9d6"
    },
    {
      "kind": "PORTS",
      "path": "contracts/manifests/providers/network-provider.json",
      "sha256": "64970ecfb360b9add757ccca1c9adf8b6f6964b6a0e793285f3b1f29efbea9d6"
    },
    {
      "kind": "INPUT_SCHEMA",
      "path": "contracts/gowm-v0.5/network-snap-request.schema.json",
      "sha256": "d63fe16bae3534403a320abd21c79d98c9d6914c694cbe810d6773913cf084cb"
    },
    {
      "kind": "OUTPUT_SCHEMA",
      "path": "contracts/gowm-v0.5/network-build-result.schema.json",
      "sha256": "be1fbd02ea7c8c826c910dbbf742bde188ac19037acc419490f1529219dbbe57"
    },
    {
      "kind": "TYPESCRIPT_IMPLEMENTATION",
      "path": "services/providers/network-provider/src/provider.ts",
      "sha256": "7acf21998b589490430ea8cac70dbef37de4293a8e00c58a3c7439f65964b527",
      "symbol": "createNetworkProvider"
    },
    {
      "kind": "TYPESCRIPT_IMPLEMENTATION",
      "path": "services/providers/network-provider/src/repository.ts",
      "sha256": "ea3727d5e7d786c403f067c9a14962c80240fef02fd2d63568c2d3c56a953357"
    },
    {
      "kind": "UNIT_TEST",
      "path": "tests/platform/network-provider.test.ts",
      "sha256": "34f5761606bf85a5ba9b0bc265567d002fcdf8c011a23cbbf7411d3a900aa663"
    },
    {
      "kind": "BLACK_BOX_TEST",
      "path": "reports/gowm-v0.6.2/black-box-evidence.json",
      "sha256": "c15b5491375487dd3c3df4a4d94887deaa490cb89fad4c9da27620ebfb6a1482",
      "symbol": "network.connectivity.inspect@1.0"
    }
  ],
  "status": "PROVEN",
  "notes": [
    "Provider-owned declaration reconciled against the descriptor, input/output schema, adapter handler and tests. Reference kinds describe accepted/produced contract syntax, not guaranteed matches; empty results do not prove absence."
  ]
}
