{
  "schemaVersion": "1.0",
  "providerId": "gowm.operational-reality",
  "operationId": "operational-task.get",
  "operationVersion": "1.0",
  "semanticProfileHash": "sha256:2457793708b3c144eae88ee189d57bdf01816d58472dec8ce02b88106fdbca3b",
  "rulesApplied": [
    "S001",
    "S002",
    "S003",
    "S004",
    "S005",
    "S006",
    "S007",
    "S008",
    "S009",
    "S010",
    "S011",
    "S012",
    "S013",
    "S014"
  ],
  "evidence": [
    {
      "kind": "DESCRIPTOR",
      "path": "contracts/manifests/providers/operational-reality-provider.json",
      "sha256": "0c1d7e4ce98e2bd0aaf246422ecdfc793ddc10bfa9a732e0a427a260111c69bf"
    },
    {
      "kind": "PORTS",
      "path": "contracts/manifests/providers/operational-reality-provider.json",
      "sha256": "0c1d7e4ce98e2bd0aaf246422ecdfc793ddc10bfa9a732e0a427a260111c69bf"
    },
    {
      "kind": "INPUT_SCHEMA",
      "path": "contracts/gowm-v0.4/operational-query-request.schema.json",
      "sha256": "8ad08440e1e6842255d0bbc15602bf15408f96b1c136722e488032e30eca6ec8"
    },
    {
      "kind": "OUTPUT_SCHEMA",
      "path": "contracts/gowm-v0.4/operational-task-snapshot.schema.json",
      "sha256": "266359fc72e3f7b114ebb5693c9f55dc2143c73f2fe470581147082fd13f1738"
    },
    {
      "kind": "TYPESCRIPT_IMPLEMENTATION",
      "path": "services/providers/operational-reality-provider/src/provider.ts",
      "sha256": "9256988d2998b16097903069e78d2a02fe6517bc4a31033c4b6d602d5d1cf916",
      "symbol": "createOperationalRealityProvider"
    },
    {
      "kind": "TYPESCRIPT_IMPLEMENTATION",
      "path": "services/providers/operational-reality-provider/src/repository.ts",
      "sha256": "4d5e64c62ca552180bc41135f3d39a995dcf0e231ac37b72bc42d83ee8ea2af4"
    },
    {
      "kind": "UNIT_TEST",
      "path": "tests/platform/operational-reality-provider.test.ts",
      "sha256": "01eee9029ab9ab693fc602c09684bf887a614b7faab72e0ede57b358aed40d5b"
    }
  ],
  "status": "PROVEN",
  "notes": [
    "Provider-owned declaration reconciled against the descriptor, input/output schema, adapter handler and tests. Reference kinds describe accepted/produced contract syntax, not guaranteed matches; empty results do not prove absence."
  ]
}
