{
  "schemaVersion": "1.0",
  "providerId": "gowm.operational-reality",
  "operationId": "operational-task.get-execution-intervals",
  "operationVersion": "1.0",
  "semanticProfileHash": "sha256:54bc15f64bb7b406c7fa007aad556d806736f8ae4d003ad866e031fd5ddd5744",
  "rulesApplied": [
    "S001",
    "S002",
    "S003",
    "S004",
    "S005",
    "S006",
    "S007",
    "S008",
    "S009",
    "S010",
    "S011",
    "S012",
    "S013",
    "S014"
  ],
  "evidence": [
    {
      "kind": "DESCRIPTOR",
      "path": "contracts/manifests/providers/operational-reality-provider.json",
      "sha256": "0c1d7e4ce98e2bd0aaf246422ecdfc793ddc10bfa9a732e0a427a260111c69bf"
    },
    {
      "kind": "PORTS",
      "path": "contracts/manifests/providers/operational-reality-provider.json",
      "sha256": "0c1d7e4ce98e2bd0aaf246422ecdfc793ddc10bfa9a732e0a427a260111c69bf"
    },
    {
      "kind": "INPUT_SCHEMA",
      "path": "contracts/gowm-v0.7.1/task-execution-interval-query.schema.json",
      "sha256": "75dc64dc07abd98b7a01e4b27ddbfdc362434c2944b7b456e2fb4cd1871486bf"
    },
    {
      "kind": "OUTPUT_SCHEMA",
      "path": "contracts/gowm-v0.7.1/task-execution-interval-result.schema.json",
      "sha256": "4c80a458bbecee377665ba3e654693974cb5368f80c3260155231fb1ad7d053b"
    },
    {
      "kind": "TYPESCRIPT_IMPLEMENTATION",
      "path": "services/providers/operational-reality-provider/src/provider.ts",
      "sha256": "9256988d2998b16097903069e78d2a02fe6517bc4a31033c4b6d602d5d1cf916",
      "symbol": "createOperationalRealityProvider"
    },
    {
      "kind": "TYPESCRIPT_IMPLEMENTATION",
      "path": "services/providers/operational-reality-provider/src/repository.ts",
      "sha256": "4d5e64c62ca552180bc41135f3d39a995dcf0e231ac37b72bc42d83ee8ea2af4"
    },
    {
      "kind": "UNIT_TEST",
      "path": "tests/platform/operational-interval-provider.test.ts",
      "sha256": "6017894ee9c70d635a27785fe46b7c21a3004298cb14067bb78fef4064a230c3"
    }
  ],
  "status": "PROVEN",
  "notes": [
    "The preview query reads immutable interval revisions at the effective snapshot capturedAt, exposes projection lag as PARTIAL, and separately discovers each interval input event set and the current query-visible event set alongside scoped task and method-profile resources."
  ]
}
