{
  "schemaVersion": "1.0",
  "providerId": "gowm.operational-reality",
  "operationId": "predicate.evaluate",
  "operationVersion": "1.0",
  "semanticProfileHash": "sha256:61b04699fbafd5f5dfdbaac6beabcdc5ddd533bb07305c4a5f14ceddf8a33c52",
  "rulesApplied": [
    "S001",
    "S002",
    "S003",
    "S004",
    "S005",
    "S006",
    "S007",
    "S008",
    "S009",
    "S010",
    "S011",
    "S012",
    "S013",
    "S014"
  ],
  "evidence": [
    {
      "kind": "DESCRIPTOR",
      "path": "contracts/manifests/providers/operational-reality-provider.json",
      "sha256": "c080c0392c115e7cdf17b37c625271e9c15b5e08e68a151f77f48a3424224b4a"
    },
    {
      "kind": "PORTS",
      "path": "contracts/manifests/providers/operational-reality-provider.json",
      "sha256": "c080c0392c115e7cdf17b37c625271e9c15b5e08e68a151f77f48a3424224b4a"
    },
    {
      "kind": "INPUT_SCHEMA",
      "path": "contracts/gowm-v0.4/external-predicate.schema.json",
      "sha256": "4ada1a2e340fc58904e96c989e255b4c658958415b6db45fb31913d99b8717ef"
    },
    {
      "kind": "OUTPUT_SCHEMA",
      "path": "contracts/gowm-v0.4/predicate-evaluation.schema.json",
      "sha256": "d1d0d1d168ede096d6dd1caf590def9000b2305b7a5d2daa4a972b2c74bf2e31"
    },
    {
      "kind": "TYPESCRIPT_IMPLEMENTATION",
      "path": "services/providers/operational-reality-provider/src/provider.ts",
      "sha256": "0e030bde687602f155f1ca06769d5927a85a0a53fd8669eeae396069b681526f",
      "symbol": "createOperationalRealityProvider"
    },
    {
      "kind": "TYPESCRIPT_IMPLEMENTATION",
      "path": "services/providers/operational-reality-provider/src/repository.ts",
      "sha256": "815555119f748824fd672fdd1d98235e0c6dbe0356ccbfa3392d45fe69040a53"
    },
    {
      "kind": "UNIT_TEST",
      "path": "tests/platform/operational-reality-provider.test.ts",
      "sha256": "b1645694fa469b8bc9091f4287ceb5289ed7e62a426007eb8ebc5e2723770e41"
    }
  ],
  "status": "PROVEN",
  "notes": [
    "Provider-owned declaration reconciled against the descriptor, input/output schema, adapter handler and tests. Reference kinds describe accepted/produced contract syntax, not guaranteed matches; empty results do not prove absence."
  ]
}
