{
  "schemaVersion": "1.0",
  "providerId": "gowm.geometry.bridge",
  "operationId": "geometry.symmetric-difference",
  "operationVersion": "1.0",
  "semanticProfileHash": "sha256:0d8cf3ce49f44c07a948401f873409525974eb296f8c954fdedd69074adff4bf",
  "rulesApplied": [
    "S001",
    "S002",
    "S003",
    "S004",
    "S005",
    "S006",
    "S007",
    "S008",
    "S009",
    "S010",
    "S011",
    "S012",
    "S013",
    "S014"
  ],
  "evidence": [
    {
      "kind": "DESCRIPTOR",
      "path": "contracts/manifests/providers/geometry-provider.json",
      "sha256": "08ffc233f3052a8042aa2a5620deb8e62309870e6cc9ecdb4b6c3bd6afd5330f"
    },
    {
      "kind": "PORTS",
      "path": "contracts/manifests/providers/geometry-provider.json",
      "sha256": "08ffc233f3052a8042aa2a5620deb8e62309870e6cc9ecdb4b6c3bd6afd5330f"
    },
    {
      "kind": "INPUT_SCHEMA",
      "path": "contracts/capabilities/geometry.symmetric-difference/input-1.0.schema.json",
      "sha256": "21a0e57dd907a9b151f1729893805c33e9771a5a8faefc459698819467f21490"
    },
    {
      "kind": "OUTPUT_SCHEMA",
      "path": "contracts/capabilities/geometry.symmetric-difference/output-1.0.schema.json",
      "sha256": "2d79fb72ae5b303154587d4216dedcd01b6d518dc2a3b6e41b05ca06ad7c3ee9"
    },
    {
      "kind": "TYPESCRIPT_IMPLEMENTATION",
      "path": "services/providers/geometry-provider-bridge/src/provider.ts",
      "sha256": "356d50b35a00a5440895b68144c39a9393a79c789b37514f3f12d274ae760edb",
      "symbol": "createGeometryProviderBridge"
    },
    {
      "kind": "UNIT_TEST",
      "path": "tests/platform/geometry-provider-bridge.test.ts",
      "sha256": "cbb128dc19406bc1bffb7ebaa06b06d7f2e3484279d5005f4b480b4e253d81c4"
    },
    {
      "kind": "SOURCE_LOCK",
      "path": "contracts/manifests/providers/geometry-provider-source-lock.json",
      "sha256": "fe33a04273bd8721e969bf5ab927efb6365b814e10ffd06d1f7782556931a8a1"
    }
  ],
  "status": "PROVEN",
  "notes": [
    "Provider-owned declaration reconciled against the descriptor, input/output schema, adapter handler and tests. Reference kinds describe accepted/produced contract syntax, not guaranteed matches; empty results do not prove absence."
  ]
}
