{
  "schemaVersion": "1.0",
  "providerId": "gowm.spatial-analysis.bridge",
  "operationId": "spatial.find-nearby",
  "operationVersion": "1.0",
  "semanticProfileHash": "sha256:80e56fb4f234644890de458056d66b78903f1f458460b8a066da75a4a2f18eff",
  "rulesApplied": [
    "S001",
    "S002",
    "S003",
    "S004",
    "S005",
    "S006",
    "S007",
    "S008",
    "S009",
    "S010",
    "S011",
    "S012",
    "S013",
    "S014"
  ],
  "evidence": [
    {
      "kind": "DESCRIPTOR",
      "path": "contracts/manifests/providers/spatial-provider.json",
      "sha256": "8d20a19768f7c1f314da91d32a905e8b933e9a4e2d6fa38adc08d6772db05315"
    },
    {
      "kind": "PORTS",
      "path": "contracts/manifests/providers/spatial-provider.json",
      "sha256": "8d20a19768f7c1f314da91d32a905e8b933e9a4e2d6fa38adc08d6772db05315"
    },
    {
      "kind": "INPUT_SCHEMA",
      "path": "contracts/capabilities/spatial.find-nearby/input-1.0.schema.json",
      "sha256": "18688d5c9f00efaca3e611cb2c0985d957c41b4cbe6a8075c92babc25b195cc2"
    },
    {
      "kind": "OUTPUT_SCHEMA",
      "path": "contracts/capabilities/spatial.find-nearby/output-1.0.schema.json",
      "sha256": "4b43f4afff71980cddcd7185ed16e5b6701bcdcb607a2da0cc698b95969cd28d"
    },
    {
      "kind": "TYPESCRIPT_IMPLEMENTATION",
      "path": "services/providers/spatial-provider-bridge/src/provider.ts",
      "sha256": "ea4ae2e51796243a9330a610e1bf2a6b8deaa2b1885cffcfbdd6498657fe6791",
      "symbol": "createSpatialProviderBridge"
    },
    {
      "kind": "TYPESCRIPT_IMPLEMENTATION",
      "path": "services/providers/spatial-provider-bridge/src/repository.ts",
      "sha256": "10bc6c4038ee405243a37876ab51575fd6f9da20e3924b68d0853c1b71b8f76f"
    },
    {
      "kind": "UNIT_TEST",
      "path": "validation/provider-conformance/spatial/spatial-provider-bridge.test.ts",
      "sha256": "db1b3a3875fde44b12368187ab7ce112758101345b0699fa014ee4fe0d9cb531"
    },
    {
      "kind": "SQL_IMPLEMENTATION",
      "path": "database/migrations/012_gowm_spatial_v1_read_contract.sql",
      "sha256": "a04f0c58ce5f5f6c4cdc850e18ef42f7da78f06ed56cb276d21774fba28afe10"
    },
    {
      "kind": "SOURCE_LOCK",
      "path": "contracts/manifests/providers/spatial-provider-source-lock.json",
      "sha256": "91ce88a93ae04714b99e5062451e8a7b1517d3ea327e947c5d2e4b038b14bcb1"
    },
    {
      "kind": "SQL_IMPLEMENTATION",
      "path": "services/providers/spatial-provider-bridge/src/sql.ts",
      "sha256": "24dabedcf4f187bea7270bf2e4db9f4f9918b7a16833991f8c29ace9ca6e4db9",
      "symbol": "buildSpatialQuery"
    }
  ],
  "status": "BLOCKED",
  "notes": [
    "Exact predicates are checked in the AST of the operation SQL produced by buildSpatialQuery. ST_Covers includes boundary contact; ST_Intersects tests true geometry, not bounding boxes. Geography distance uses WGS84 spheroid meters. Generic ReferenceKey fields are structurally detected even without an enum; explicit kinds are constrained by the cited versioned SQL/validation authority.",
    "Static profile resolved; current real black-box execution remains required for Stable admission."
  ]
}
