{
  "schemaVersion": "1.0",
  "providerId": "gowm.network",
  "operationId": "network.path.shortest",
  "operationVersion": "1.0",
  "semanticProfileHash": "sha256:6b69890bd6c146a0fafc2a8ffde2c12b4d0296dd75241a255f3a615f428ada91",
  "rulesApplied": [
    "S001",
    "S002",
    "S003",
    "S004",
    "S005",
    "S006",
    "S007",
    "S008",
    "S009",
    "S010",
    "S011",
    "S012",
    "S013",
    "S014"
  ],
  "evidence": [
    {
      "kind": "DESCRIPTOR",
      "path": "contracts/manifests/providers/network-provider.json",
      "sha256": "64970ecfb360b9add757ccca1c9adf8b6f6964b6a0e793285f3b1f29efbea9d6"
    },
    {
      "kind": "PORTS",
      "path": "contracts/manifests/providers/network-provider.json",
      "sha256": "64970ecfb360b9add757ccca1c9adf8b6f6964b6a0e793285f3b1f29efbea9d6"
    },
    {
      "kind": "INPUT_SCHEMA",
      "path": "contracts/gowm-v0.5/network-shortest-path-request.schema.json",
      "sha256": "b1bed7cd90744523d035567b0fbae0382a8fddc014728fef93158cadbdc48355"
    },
    {
      "kind": "OUTPUT_SCHEMA",
      "path": "contracts/gowm-v0.5/network-shortest-path-result.schema.json",
      "sha256": "c4bc84c55f7f67266f99ee799bb8c826d45df2d80ff9ad902e8d1a5669db7794"
    },
    {
      "kind": "TYPESCRIPT_IMPLEMENTATION",
      "path": "services/providers/network-provider/src/provider.ts",
      "sha256": "7acf21998b589490430ea8cac70dbef37de4293a8e00c58a3c7439f65964b527",
      "symbol": "createNetworkProvider"
    },
    {
      "kind": "TYPESCRIPT_IMPLEMENTATION",
      "path": "services/providers/network-provider/src/repository.ts",
      "sha256": "ea3727d5e7d786c403f067c9a14962c80240fef02fd2d63568c2d3c56a953357"
    },
    {
      "kind": "UNIT_TEST",
      "path": "tests/platform/network-provider.test.ts",
      "sha256": "43aebea0c8bc9737703a2340fc5d233d4d4b1547116202396bbf642551dd7ab5"
    },
    {
      "kind": "TYPESCRIPT_IMPLEMENTATION",
      "path": "packages/network-query-core/src/engine.ts",
      "sha256": "0d076717c6af5df10e71f1ef46a416dc936601549029593ccd33d5021810f74d",
      "symbol": "verifyPath"
    }
  ],
  "status": "BLOCKED",
  "notes": [
    "Provider-owned declaration reconciled against the descriptor, input/output schema, adapter handler and tests. Reference kinds describe accepted/produced contract syntax, not guaranteed matches; empty results do not prove absence.",
    "Static profile resolved; current real black-box execution remains required for Stable admission."
  ]
}
